No,;Time;Source;Destination;Protocol;Length;Info;;;;;;;;;;;;;;;;;;;;;
1;0;23,7,217,88;192,168,43,47;TCP;54;443  >  49718 [ACK] Seq=1 Ack=1 Win=245 Len=0;;;;;;;;;;;;;;;;time 2;Time 2;;delay 2;delay 1;jiter
3;0,137533;23,7,217,88;192,168,43,47;TLSv1,2;319;Application Data;;;;;;;;;;;;;;;;0,137533;0;;0,004878;0,137533;0,132655
4;0,142411;192,168,43,47;23,7,217,88;TCP;54;49718  >  443 [FIN, ACK] Seq=1 Ack=266 Win=253 Len=0;;;;;;;;;;;;;;;;0,142411;0,137533;;0,034029;0,004878;0,029151
7;0,17644;192,168,43,47;23,7,217,88;TCP;66;49720  >  443 [SYN] Seq=0 Win=64240 Len=0 MSS=1460 WS=256 SACK_PERM=1;;;;;;;;;;;;;;;;0,17644;0,142411;;0,059807;0,034029;0,025778
8;0,236247;23,7,217,88;192,168,43,47;TCP;54;[TCP Previous segment not captured] 443  >  49718 [FIN, ACK] Seq=297 Ack=2 Win=245 Len=0;;;;;;;;;;;;;;;;0,236247;0,17644;;0,000163;0,059807;0,059644
9;0,23641;192,168,43,47;23,7,217,88;TCP;54;[TCP Dup ACK 4#1] 49718  >  443 [ACK] Seq=2 Ack=266 Win=253 Len=0;;;;;;;;;;;;;;;;0,23641;0,236247;;0,000309;0,000163;0,000146
10;0,236719;23,7,217,88;192,168,43,47;TCP;85;[TCP Out-Of-Order] 443  >  49718 [PSH, ACK] Seq=266 Ack=2 Win=245 Len=31;;;;;;;;;;;;;;;;0,236719;0,23641;;7,6E-05;0,000309;0,000233
11;0,236795;192,168,43,47;23,7,217,88;TCP;54;49718  >  443 [RST, ACK] Seq=2 Ack=297 Win=0 Len=0;;;;;;;;;;;;;;;;0,236795;0,236719;;0,039616;7,6E-05;0,03954
12;0,276411;23,7,217,88;192,168,43,47;TCP;66;443  >  49720 [SYN, ACK] Seq=0 Ack=1 Win=29200 Len=0 MSS=1400 SACK_PERM=1 WS=128;;;;;;;;;;;;;;;;0,276411;0,236795;;0,000252;0,039616;0,039364
13;0,276663;192,168,43,47;23,7,217,88;TCP;54;49720  >  443 [ACK] Seq=1 Ack=1 Win=65792 Len=0;;;;;;;;;;;;;;;;0,276663;0,276411;;0,002347;0,000252;0,002095
14;0,27901;192,168,43,47;23,7,217,88;TLSv1,2;271;Client Hello;;;;;;;;;;;;;;;;0,27901;0,276663;;0,049246;0,002347;0,046899
15;0,328256;147,135,46,101;192,168,43,47;TCP;54;80  >  49717 [ACK] Seq=1 Ack=1 Win=26800 Len=0;;;;;;;;;;;;;;;;0,328256;0,27901;;0,00432;0,049246;0,044926
16;0,332576;147,135,46,101;192,168,43,47;HTTP;204;HTTP/1,1 200 OK  (text/html);;;;;;;;;;;;;;;;0,332576;0,328256;;0,000161;0,00432;0,004159
17;0,332737;192,168,43,47;147,135,46,101;TCP;54;49717  >  80 [ACK] Seq=1 Ack=151 Win=65535 Len=0;;;;;;;;;;;;;;;;0,332737;0,332576;;0,045742;0,000161;0,045581
18;0,378479;23,7,217,88;192,168,43,47;TCP;54;443  >  49720 [ACK] Seq=1 Ack=218 Win=30336 Len=0;;;;;;;;;;;;;;;;0,378479;0,332737;;0,000319;0,045742;0,045423
19;0,378798;23,7,217,88;192,168,43,47;TLSv1,2;1454;Server Hello;;;;;;;;;;;;;;;;0,378798;0,378479;;0,00042;0,000319;0,000101
20;0,379218;23,7,217,88;192,168,43,47;TCP;1454;443  >  49720 [ACK] Seq=1401 Ack=218 Win=30336 Len=1400 [TCP segment of a reassembled PDU];;;;;;;;;;;;;;;;0,379218;0,378798;;9,8E-05;0,00042;0,000322
21;0,379316;192,168,43,47;23,7,217,88;TCP;54;49720  >  443 [ACK] Seq=218 Ack=2801 Win=65792 Len=0;;;;;;;;;;;;;;;;0,379316;0,379218;;0,000612;9,8E-05;0,000514
22;0,379928;23,7,217,88;192,168,43,47;TLSv1,2;1350;Certificate [TCP segment of a reassembled PDU];;;;;;;;;;;;;;;;0,379928;0,379316;;0;0,000612;0,000612
23;0,379928;23,7,217,88;192,168,43,47;TLSv1,2;1454;Certificate Status [TCP segment of a reassembled PDU];;;;;;;;;;;;;;;;0,379928;0,379928;;0,000245;0;0,000245
24;0,380173;192,168,43,47;23,7,217,88;TCP;54;49720  >  443 [ACK] Seq=218 Ack=5497 Win=65792 Len=0;;;;;;;;;;;;;;;;0,380173;0,379928;;0,089577;0,000245;0,089332
25;0,46975;23,7,217,88;192,168,43,47;TLSv1,2;336;Server Key Exchange, Server Hello Done;;;;;;;;;;;;;;;;0,46975;0,380173;;0,007049;0,089577;0,082528
26;0,476799;192,168,43,47;23,7,217,88;TLSv1,2;180;Client Key Exchange, Change Cipher Spec, Encrypted Handshake Message;;;;;;;;;;;;;;;;0,476799;0,46975;;0,087358;0,007049;0,080309
27;0,564157;23,7,217,88;192,168,43,47;TLSv1,2;328;New Session Ticket, Change Cipher Spec, Encrypted Handshake Message;;;;;;;;;;;;;;;;0,564157;0,476799;;0,002562;0,087358;0,084796
28;0,566719;192,168,43,47;23,7,217,88;TLSv1,2;587;Application Data;;;;;;;;;;;;;;;;0,566719;0,564157;;0,157669;0,002562;0,155107
29;0,724388;23,7,217,88;192,168,43,47;TCP;54;443  >  49720 [ACK] Seq=6053 Ack=877 Win=31360 Len=0;;;;;;;;;;;;;;;;0,724388;0,566719;;0,107857;0,157669;0,049812
30;0,832245;23,7,217,88;192,168,43,47;TLSv1,2;749;Application Data;;;;;;;;;;;;;;;;0,832245;0,724388;;0,003359;0,107857;0,104498
31;0,835604;192,168,43,47;23,7,217,88;TCP;54;49720  >  443 [FIN, ACK] Seq=877 Ack=6748 Win=64512 Len=0;;;;;;;;;;;;;;;;0,835604;0,832245;;0,072358;0,003359;0,068999
34;0,907962;192,168,43,47;23,7,217,88;TCP;66;49721  >  443 [SYN] Seq=0 Win=64240 Len=0 MSS=1460 WS=256 SACK_PERM=1;;;;;;;;;;;;;;;;0,907962;0,835604;;0,020145;0,072358;0,052213
35;0,928107;23,7,217,88;192,168,43,47;TLSv1,2;85;Encrypted Alert;;;;;;;;;;;;;;;;0,928107;0,907962;;0,000168;0,020145;0,019977
36;0,928275;192,168,43,47;23,7,217,88;TCP;54;49720  >  443 [RST, ACK] Seq=878 Ack=6779 Win=0 Len=0;;;;;;;;;;;;;;;;0,928275;0,928107;;0,000305;0,000168;0,000137
37;0,92858;23,7,217,88;192,168,43,47;TCP;54;443  >  49720 [FIN, ACK] Seq=6779 Ack=878 Win=31360 Len=0;;;;;;;;;;;;;;;;0,92858;0,928275;;0,059786;0,000305;0,059481
38;0,988366;23,7,217,88;192,168,43,47;TCP;66;443  >  49721 [SYN, ACK] Seq=0 Ack=1 Win=29200 Len=0 MSS=1400 SACK_PERM=1 WS=128;;;;;;;;;;;;;;;;0,988366;0,92858;;0,000229;0,059786;0,059557
39;0,988595;192,168,43,47;23,7,217,88;TCP;54;49721  >  443 [ACK] Seq=1 Ack=1 Win=65792 Len=0;;;;;;;;;;;;;;;;0,988595;0,988366;;0,001065;0,000229;0,000836
40;0,98966;192,168,43,47;23,7,217,88;TLSv1,2;271;Client Hello;;;;;;;;;;;;;;;;0,98966;0,988595;;1084598,01;0,001065;1084598,009
41;1.084.599;23,7,217,88;192,168,43,47;TCP;54;443  >  49721 [ACK] Seq=1 Ack=218 Win=30336 Len=0;;;;;;;;;;;;;;;;1.084.599;0,98966;;0;1084598,01;1084598,01
42;1.084.599;23,7,217,88;192,168,43,47;TLSv1,2;1454;Server Hello;;;;;;;;;;;;;;;;1.084.599;1.084.599;;0;0;0
43;1.084.599;23,7,217,88;192,168,43,47;TCP;1350;[TCP Previous segment not captured] 443  >  49721 [PSH, ACK] Seq=2801 Ack=218 Win=30336 Len=1296 [TCP segment of a reassembled PDU] [TCP segment of a reassembled PDU];;;;;;;;;;;;;;;;1.084.599;1.084.599;;198;0;198
44;1.084.797;192,168,43,47;23,7,217,88;TCP;66;49721  >  443 [ACK] Seq=218 Ack=1401 Win=65792 Len=0 SLE=2801 SRE=4097;;;;;;;;;;;;;;;;1.084.797;1.084.599;;333;198;135
45;1.085.130;23,7,217,88;192,168,43,47;TCP;1454;[TCP Out-Of-Order] 443  >  49721 [ACK] Seq=1401 Ack=218 Win=30336 Len=1400;;;;;;;;;;;;;;;;1.085.130;1.084.797;;0;333;333
46;1.085.130;23,7,217,88;192,168,43,47;TLSv1,2;1454;Certificate Status [TCP segment of a reassembled PDU];;;;;;;;;;;;;;;;1.085.130;1.085.130;;100;0;100
47;1.085.230;192,168,43,47;23,7,217,88;TCP;54;49721  >  443 [ACK] Seq=218 Ack=4097 Win=65792 Len=0;;;;;;;;;;;;;;;;1.085.230;1.085.130;;95;100;5
48;1.085.325;192,168,43,47;23,7,217,88;TCP;54;49721  >  443 [ACK] Seq=218 Ack=5497 Win=65792 Len=0;;;;;;;;;;;;;;;;1.085.325;1.085.230;;81975;95;81880
49;1.167.300;23,7,217,88;192,168,43,47;TLSv1,2;336;Server Key Exchange, Server Hello Done;;;;;;;;;;;;;;;;1.167.300;1.085.325;;6998;81975;74977
50;1.174.298;192,168,43,47;23,7,217,88;TLSv1,2;180;Client Key Exchange, Change Cipher Spec, Encrypted Handshake Message;;;;;;;;;;;;;;;;1.174.298;1.167.300;;81168;6998;74170
51;1.255.466;23,7,217,88;192,168,43,47;TLSv1,2;328;New Session Ticket, Change Cipher Spec, Encrypted Handshake Message;;;;;;;;;;;;;;;;1.255.466;1.174.298;;2448;81168;78720
52;1.257.914;192,168,43,47;23,7,217,88;TLSv1,2;587;Application Data;;;;;;;;;;;;;;;;1.257.914;1.255.466;;87362;2448;84914
53;1.345.276;23,7,217,88;192,168,43,47;TLSv1,2;747;Application Data;;;;;;;;;;;;;;;;1.345.276;1.257.914;;3898;87362;83464
54;1.349.174;192,168,43,47;23,7,217,88;TCP;54;49721  >  443 [FIN, ACK] Seq=877 Ack=6746 Win=64512 Len=0;;;;;;;;;;;;;;;;1.349.174;1.345.276;;78505;3898;74607
56;1.427.679;23,7,217,88;192,168,43,47;TCP;54;[TCP Previous segment not captured] 443  >  49721 [FIN, ACK] Seq=6777 Ack=878 Win=31360 Len=0;;;;;;;;;;;;;;;;1.427.679;1.349.174;;190;78505;78315
57;1.427.869;192,168,43,47;23,7,217,88;TCP;54;[TCP Dup ACK 54#1] 49721  >  443 [ACK] Seq=878 Ack=6746 Win=64512 Len=0;;;;;;;;;;;;;;;;1.427.869;1.427.679;;306;190;116
58;1.428.175;23,7,217,88;192,168,43,47;TCP;85;[TCP Out-Of-Order] 443  >  49721 [PSH, ACK] Seq=6746 Ack=878 Win=31360 Len=31;;;;;;;;;;;;;;;;1.428.175;1.427.869;;78;306;228
59;1.428.253;192,168,43,47;23,7,217,88;TCP;54;49721  >  443 [RST, ACK] Seq=878 Ack=6777 Win=0 Len=0;;;;;;;;;;;;;;;;1.428.253;1.428.175;;20559;78;20481
61;1.448.812;192,168,43,47;23,7,217,88;TCP;66;49724  >  443 [SYN] Seq=0 Win=64240 Len=0 MSS=1460 WS=256 SACK_PERM=1;;;;;;;;;;;;;;;;1.448.812;1.428.253;;74871;20559;54312
62;1.523.683;23,7,217,88;192,168,43,47;TCP;66;443  >  49724 [SYN, ACK] Seq=0 Ack=1 Win=29200 Len=0 MSS=1400 SACK_PERM=1 WS=128;;;;;;;;;;;;;;;;1.523.683;1.448.812;;226;74871;74645
63;1.523.909;192,168,43,47;23,7,217,88;TCP;54;49724  >  443 [ACK] Seq=1 Ack=1 Win=65792 Len=0;;;;;;;;;;;;;;;;1.523.909;1.523.683;;1059;226;833
64;1.524.968;192,168,43,47;23,7,217,88;TLSv1,2;271;Client Hello;;;;;;;;;;;;;;;;1.524.968;1.523.909;;87346;1059;86287
65;1.612.314;23,7,217,88;192,168,43,47;TCP;54;443  >  49724 [ACK] Seq=1 Ack=218 Win=30336 Len=0;;;;;;;;;;;;;;;;1.612.314;1.524.968;;920;87346;86426
66;1.613.234;23,7,217,88;192,168,43,47;TCP;1454;[TCP Previous segment not captured] 443  >  49724 [ACK] Seq=1401 Ack=218 Win=30336 Len=1400 [TCP segment of a reassembled PDU];;;;;;;;;;;;;;;;1.613.234;1.612.314;;108;920;812
67;1.613.342;192,168,43,47;23,7,217,88;TCP;66;[TCP Dup ACK 63#1] 49724  >  443 [ACK] Seq=218 Ack=1 Win=65792 Len=0 SLE=1401 SRE=2801;;;;;;;;;;;;;;;;1.613.342;1.613.234;;312;108;204
68;1.613.654;23,7,217,88;192,168,43,47;TCP;1350;443  >  49724 [PSH, ACK] Seq=2801 Ack=218 Win=30336 Len=1296 [TCP segment of a reassembled PDU] [TCP segment of a reassembled PDU];;;;;;;;;;;;;;;;1.613.654;1.613.342;;67;312;245
69;1.613.721;192,168,43,47;23,7,217,88;TCP;66;[TCP Dup ACK 63#2] 49724  >  443 [ACK] Seq=218 Ack=1 Win=65792 Len=0 SLE=1401 SRE=4097;;;;;;;;;;;;;;;;1.613.721;1.613.654;;359;67;292
70;1.614.080;23,7,217,88;192,168,43,47;TLSv1,2;1454;[TCP Fast Retransmission] , Server Hello;;;;;;;;;;;;;;;;1.614.080;1.613.721;;97;359;262
71;1.614.177;192,168,43,47;23,7,217,88;TCP;54;49724  >  443 [ACK] Seq=218 Ack=4097 Win=65792 Len=0;;;;;;;;;;;;;;;;1.614.177;1.614.080;;17608;97;17511
72;1.631.785;23,7,217,88;192,168,43,47;TLSv1,2;1454;Ignored Unknown Record;;;;;;;;;;;;;;;;1.631.785;1.614.177;;43146;17608;25538
73;1.674.931;192,168,43,47;23,7,217,88;TCP;54;49724  >  443 [ACK] Seq=218 Ack=5497 Win=65792 Len=0;;;;;;;;;;;;;;;;1.674.931;1.631.785;;11384;43146;31762
74;1.686.315;23,7,217,88;192,168,43,47;TLSv1,2;336;Ignored Unknown Record;;;;;;;;;;;;;;;;1.686.315;1.674.931;;7071;11384;4313
75;1.693.386;192,168,43,47;23,7,217,88;TLSv1,2;180;Client Key Exchange, Change Cipher Spec, Encrypted Handshake Message;;;;;;;;;;;;;;;;1.693.386;1.686.315;;90941;7071;83870
76;1.784.327;23,7,217,88;192,168,43,47;TLSv1,2;328;New Session Ticket, Change Cipher Spec, Encrypted Handshake Message;;;;;;;;;;;;;;;;1.784.327;1.693.386;;2544;90941;88397
77;1.786.871;192,168,43,47;23,7,217,88;TLSv1,2;584;Application Data;;;;;;;;;;;;;;;;1.786.871;1.784.327;;105728;2544;103184
78;1.892.599;23,7,217,88;192,168,43,47;TLSv1,2;726;Application Data;;;;;;;;;;;;;;;;1.892.599;1.786.871;;2782;105728;102946
79;1.895.381;192,168,43,47;23,7,217,88;TCP;54;49724  >  443 [FIN, ACK] Seq=874 Ack=6725 Win=64512 Len=0;;;;;;;;;;;;;;;;1.895.381;1.892.599;;68150;2782;65368
80;1.963.531;23,7,217,88;192,168,43,47;TCP;54;[TCP Previous segment not captured] 443  >  49724 [FIN, ACK] Seq=6756 Ack=875 Win=31360 Len=0;;;;;;;;;;;;;;;;1.963.531;1.895.381;;148;68150;68002
81;1.963.679;192,168,43,47;23,7,217,88;TCP;54;[TCP Dup ACK 79#1] 49724  >  443 [ACK] Seq=875 Ack=6725 Win=64512 Len=0;;;;;;;;;;;;;;;;1.963.679;1.963.531;;319;148;171
82;1.963.998;23,7,217,88;192,168,43,47;TCP;85;[TCP Out-Of-Order] 443  >  49724 [PSH, ACK] Seq=6725 Ack=875 Win=31360 Len=31;;;;;;;;;;;;;;;;1.963.998;1.963.679;;85;319;234
83;1.964.083;192,168,43,47;23,7,217,88;TCP;54;49724  >  443 [RST, ACK] Seq=875 Ack=6756 Win=0 Len=0;;;;;;;;;;;;;;;;1.964.083;1.963.998;;17793;85;17708
86;1.981.876;192,168,43,47;23,7,217,88;TCP;66;49725  >  443 [SYN] Seq=0 Win=64240 Len=0 MSS=1460 WS=256 SACK_PERM=1;;;;;;;;;;;;;;;;1.981.876;1.964.083;;91486;17793;73693
87;2.073.362;23,7,217,88;192,168,43,47;TCP;66;443  >  49725 [SYN, ACK] Seq=0 Ack=1 Win=29200 Len=0 MSS=1400 SACK_PERM=1 WS=128;;;;;;;;;;;;;;;;2.073.362;1.981.876;;219;91486;91267
88;2.073.581;192,168,43,47;23,7,217,88;TCP;54;49725  >  443 [ACK] Seq=1 Ack=1 Win=65792 Len=0;;;;;;;;;;;;;;;;2.073.581;2.073.362;;1081;219;862
89;2.074.662;192,168,43,47;23,7,217,88;TLSv1,2;271;Client Hello;;;;;;;;;;;;;;;;2.074.662;2.073.581;;76886;1081;75805
90;2.151.548;23,7,217,88;192,168,43,47;TCP;54;443  >  49725 [ACK] Seq=1 Ack=218 Win=30336 Len=0;;;;;;;;;;;;;;;;2.151.548;2.074.662;;951;76886;75935
91;2.152.499;23,7,217,88;192,168,43,47;TLSv1,2;1454;Server Hello;;;;;;;;;;;;;;;;2.152.499;2.151.548;;539;951;412
92;2.153.038;23,7,217,88;192,168,43,47;TCP;1454;443  >  49725 [ACK] Seq=1401 Ack=218 Win=30336 Len=1400 [TCP segment of a reassembled PDU];;;;;;;;;;;;;;;;2.153.038;2.152.499;;0;539;539
93;2.153.038;23,7,217,88;192,168,43,47;TLSv1,2;1350;Certificate [TCP segment of a reassembled PDU];;;;;;;;;;;;;;;;2.153.038;2.153.038;;121;0;121
94;2.153.159;192,168,43,47;23,7,217,88;TCP;54;49725  >  443 [ACK] Seq=218 Ack=4097 Win=65792 Len=0;;;;;;;;;;;;;;;;2.153.159;2.153.038;;9505;121;9384
95;2.162.664;23,7,217,88;192,168,43,47;TLSv1,2;1454;Certificate Status [TCP segment of a reassembled PDU];;;;;;;;;;;;;;;;2.162.664;2.153.159;;161;9505;9344
96;2.162.825;192,168,43,47;23,7,217,88;TCP;54;49725  >  443 [ACK] Seq=218 Ack=5497 Win=65792 Len=0;;;;;;;;;;;;;;;;2.162.825;2.162.664;;68790;161;68629
97;2.231.615;23,7,217,88;192,168,43,47;TLSv1,2;336;Server Key Exchange, Server Hello Done;;;;;;;;;;;;;;;;2.231.615;2.162.825;;7159;68790;61631
98;2.238.774;192,168,43,47;23,7,217,88;TLSv1,2;180;Client Key Exchange, Change Cipher Spec, Encrypted Handshake Message;;;;;;;;;;;;;;;;2.238.774;2.231.615;;84422;7159;77263
99;2.323.196;23,7,217,88;192,168,43,47;TLSv1,2;328;New Session Ticket, Change Cipher Spec, Encrypted Handshake Message;;;;;;;;;;;;;;;;2.323.196;2.238.774;;2553;84422;81869
100;2.325.749;192,168,43,47;23,7,217,88;TLSv1,2;587;Application Data;;;;;;;;;;;;;;;;2.325.749;2.323.196;;95838;2553;93285
101;2.421.587;23,7,217,88;192,168,43,47;TLSv1,2;742;Application Data;;;;;;;;;;;;;;;;2.421.587;2.325.749;;3327;95838;92511
102;2.424.914;192,168,43,47;23,7,217,88;TCP;54;49725  >  443 [FIN, ACK] Seq=877 Ack=6741 Win=64512 Len=0;;;;;;;;;;;;;;;;2.424.914;2.421.587;;72679;3327;69352
105;2.497.593;192,168,43,47;23,7,217,88;TCP;66;49726  >  443 [SYN] Seq=0 Win=64240 Len=0 MSS=1460 WS=256 SACK_PERM=1;;;;;;;;;;;;;;;;2.497.593;2.424.914;;6524;72679;66155
106;2.504.117;23,7,217,88;192,168,43,47;TLSv1,2;85;Encrypted Alert;;;;;;;;;;;;;;;;2.504.117;2.497.593;;166;6524;6358
107;2.504.283;192,168,43,47;23,7,217,88;TCP;54;49725  >  443 [RST, ACK] Seq=878 Ack=6772 Win=0 Len=0;;;;;;;;;;;;;;;;2.504.283;2.504.117;;297;166;131
108;2.504.580;23,7,217,88;192,168,43,47;TCP;54;443  >  49725 [FIN, ACK] Seq=6772 Ack=878 Win=31360 Len=0;;;;;;;;;;;;;;;;2.504.580;2.504.283;;80033;297;79736
109;2.584.613;23,7,217,88;192,168,43,47;TCP;66;443  >  49726 [SYN, ACK] Seq=0 Ack=1 Win=29200 Len=0 MSS=1400 SACK_PERM=1 WS=128;;;;;;;;;;;;;;;;2.584.613;2.504.580;;234;80033;79799
110;2.584.847;192,168,43,47;23,7,217,88;TCP;54;49726  >  443 [ACK] Seq=1 Ack=1 Win=65792 Len=0;;;;;;;;;;;;;;;;2.584.847;2.584.613;;1023;234;789
111;2.585.870;192,168,43,47;23,7,217,88;TLSv1,2;271;Client Hello;;;;;;;;;;;;;;;;2.585.870;2.584.847;;79450;1023;78427
112;2.665.320;23,7,217,88;192,168,43,47;TCP;54;443  >  49726 [ACK] Seq=1 Ack=218 Win=30336 Len=0;;;;;;;;;;;;;;;;2.665.320;2.585.870;;648;79450;78802
113;2.665.968;23,7,217,88;192,168,43,47;TCP;1454;[TCP Previous segment not captured] 443  >  49726 [ACK] Seq=1401 Ack=218 Win=30336 Len=1400;;;;;;;;;;;;;;;;2.665.968;2.665.320;;0;648;648
114;2.665.968;23,7,217,88;192,168,43,47;TLSv1,2;1350;Ignored Unknown Record;;;;;;;;;;;;;;;;2.665.968;2.665.968;;0;0;0
115;2.665.968;23,7,217,88;192,168,43,47;TCP;1454;[TCP Out-Of-Order] 443  >  49726 [ACK] Seq=1 Ack=218 Win=30336 Len=1400;;;;;;;;;;;;;;;;2.665.968;2.665.968;;123;0;123
116;2.666.091;192,168,43,47;23,7,217,88;TCP;66;[TCP Dup ACK 110#1] 49726  >  443 [ACK] Seq=218 Ack=1 Win=65792 Len=0 SLE=1401 SRE=2801;;;;;;;;;;;;;;;;2.666.091;2.665.968;;178;123;55
117;2.666.269;192,168,43,47;23,7,217,88;TCP;66;[TCP Dup ACK 110#2] 49726  >  443 [ACK] Seq=218 Ack=1 Win=65792 Len=0 SLE=1401 SRE=4097;;;;;;;;;;;;;;;;2.666.269;2.666.091;;124;178;54
118;2.666.393;192,168,43,47;23,7,217,88;TCP;54;49726  >  443 [ACK] Seq=218 Ack=4097 Win=65792 Len=0;;;;;;;;;;;;;;;;2.666.393;2.666.269;;215;124;91
119;2.666.608;23,7,217,88;192,168,43,47;TLSv1,2;1454;Ignored Unknown Record;;;;;;;;;;;;;;;;2.666.608;2.666.393;;40294;215;40079
120;2.706.902;192,168,43,47;23,7,217,88;TCP;54;49726  >  443 [ACK] Seq=218 Ack=5497 Win=65792 Len=0;;;;;;;;;;;;;;;;2.706.902;2.666.608;;51349;40294;11055
121;2.758.251;23,7,217,88;192,168,43,47;TLSv1,2;336;Ignored Unknown Record;;;;;;;;;;;;;;;;2.758.251;2.706.902;;6995;51349;44354
122;2.765.246;192,168,43,47;23,7,217,88;TLSv1,2;180;Client Key Exchange, Change Cipher Spec, Encrypted Handshake Message;;;;;;;;;;;;;;;;2.765.246;2.758.251;;95291;6995;88296
123;2.860.537;23,7,217,88;192,168,43,47;TLSv1,2;328;New Session Ticket, Change Cipher Spec, Encrypted Handshake Message;;;;;;;;;;;;;;;;2.860.537;2.765.246;;2497;95291;92794
124;2.863.034;192,168,43,47;23,7,217,88;TLSv1,2;587;Application Data;;;;;;;;;;;;;;;;2.863.034;2.860.537;;129115;2497;126618
125;2.992.149;23,7,217,88;192,168,43,47;TCP;54;443  >  49726 [ACK] Seq=6053 Ack=877 Win=31360 Len=0;;;;;;;;;;;;;;;;2.992.149;2.863.034;;106418;129115;22697
126;3.098.567;23,7,217,88;192,168,43,47;TLSv1,2;742;Application Data;;;;;;;;;;;;;;;;3.098.567;2.992.149;;14497;106418;91921
127;3.113.064;192,168,43,47;23,7,217,88;TCP;54;49726  >  443 [FIN, ACK] Seq=877 Ack=6741 Win=64512 Len=0;;;;;;;;;;;;;;;;3.113.064;3.098.567;;55093;14497;40596
130;3.168.157;192,168,43,47;23,7,217,88;TCP;66;49727  >  443 [SYN] Seq=0 Win=64240 Len=0 MSS=1460 WS=256 SACK_PERM=1;;;;;;;;;;;;;;;;3.168.157;3.113.064;;24924;55093;30169
131;3.193.081;23,7,217,88;192,168,43,47;TCP;54;[TCP Previous segment not captured] 443  >  49726 [FIN, ACK] Seq=6772 Ack=878 Win=31360 Len=0;;;;;;;;;;;;;;;;3.193.081;3.168.157;;149;24924;24775
132;3.193.230;192,168,43,47;23,7,217,88;TCP;54;[TCP Dup ACK 127#1] 49726  >  443 [ACK] Seq=878 Ack=6741 Win=64512 Len=0;;;;;;;;;;;;;;;;3.193.230;3.193.081;;299;149;150
133;3.193.529;23,7,217,88;192,168,43,47;TCP;85;[TCP Out-Of-Order] 443  >  49726 [PSH, ACK] Seq=6741 Ack=878 Win=31360 Len=31;;;;;;;;;;;;;;;;3.193.529;3.193.230;;80;299;219
134;3.193.609;192,168,43,47;23,7,217,88;TCP;54;49726  >  443 [RST, ACK] Seq=878 Ack=6772 Win=0 Len=0;;;;;;;;;;;;;;;;3.193.609;3.193.529;;58758;80;58678
135;3.252.367;23,7,217,88;192,168,43,47;TCP;66;443  >  49727 [SYN, ACK] Seq=0 Ack=1 Win=29200 Len=0 MSS=1400 SACK_PERM=1 WS=128;;;;;;;;;;;;;;;;3.252.367;3.193.609;;221;58758;58537
136;3.252.588;192,168,43,47;23,7,217,88;TCP;54;49727  >  443 [ACK] Seq=1 Ack=1 Win=65792 Len=0;;;;;;;;;;;;;;;;3.252.588;3.252.367;;1497;221;1276
137;3.254.085;192,168,43,47;23,7,217,88;TLSv1,2;271;Client Hello;;;;;;;;;;;;;;;;3.254.085;3.252.588;;70358;1497;68861
138;3.324.443;23,9,184,115;192,168,43,47;TCP;54;80  >  49682 [FIN, ACK] Seq=1 Ack=1 Win=245 Len=0;;;;;;;;;;;;;;;;3.324.443;3.254.085;;168;70358;70190
139;3.324.611;192,168,43,47;23,9,184,115;TCP;54;49682  >  80 [ACK] Seq=1 Ack=2 Win=255 Len=0;;;;;;;;;;;;;;;;3.324.611;3.324.443;;41;168;127
140;3.324.652;192,168,43,47;23,9,184,115;TCP;54;49682  >  80 [FIN, ACK] Seq=1 Ack=2 Win=255 Len=0;;;;;;;;;;;;;;;;3.324.652;3.324.611;;8548;41;8507
141;3.333.200;23,7,217,88;192,168,43,47;TCP;54;443  >  49727 [ACK] Seq=1 Ack=218 Win=30336 Len=0;;;;;;;;;;;;;;;;3.333.200;3.324.652;;435;8548;8113
142;3.333.635;23,7,217,88;192,168,43,47;TLSv1,2;1454;Server Hello;;;;;;;;;;;;;;;;3.333.635;3.333.200;;0;435;435
143;3.333.635;23,7,217,88;192,168,43,47;TCP;1350;[TCP Previous segment not captured] 443  >  49727 [PSH, ACK] Seq=2801 Ack=218 Win=30336 Len=1296 [TCP segment of a reassembled PDU] [TCP segment of a reassembled PDU];;;;;;;;;;;;;;;;3.333.635;3.333.635;;145;0;145
144;3.333.780;192,168,43,47;23,7,217,88;TCP;66;49727  >  443 [ACK] Seq=218 Ack=1401 Win=65792 Len=0 SLE=2801 SRE=4097;;;;;;;;;;;;;;;;3.333.780;3.333.635;;478;145;333
145;3.334.258;23,7,217,88;192,168,43,47;TCP;1454;[TCP Out-Of-Order] 443  >  49727 [ACK] Seq=1401 Ack=218 Win=30336 Len=1400;;;;;;;;;;;;;;;;3.334.258;3.333.780;;0;478;478
146;3.334.258;23,7,217,88;192,168,43,47;TLSv1,2;1454;Certificate Status [TCP segment of a reassembled PDU];;;;;;;;;;;;;;;;3.334.258;3.334.258;;109;0;109
147;3.334.367;192,168,43,47;23,7,217,88;TCP;54;49727  >  443 [ACK] Seq=218 Ack=4097 Win=65792 Len=0;;;;;;;;;;;;;;;;3.334.367;3.334.258;;103;109;6
148;3.334.470;192,168,43,47;23,7,217,88;TCP;54;49727  >  443 [ACK] Seq=218 Ack=5497 Win=65792 Len=0;;;;;;;;;;;;;;;;3.334.470;3.334.367;;45990;103;45887
149;3.380.460;23,9,184,115;192,168,43,47;TCP;54;80  >  49682 [ACK] Seq=2 Ack=2 Win=245 Len=0;;;;;;;;;;;;;;;;3.380.460;3.334.470;;23008;45990;22982
150;3.403.468;23,7,217,88;192,168,43,47;TLSv1,2;336;Server Key Exchange, Server Hello Done;;;;;;;;;;;;;;;;3.403.468;3.380.460;;10926;23008;12082
151;3.414.394;192,168,43,47;23,7,217,88;TLSv1,2;180;Client Key Exchange, Change Cipher Spec, Encrypted Handshake Message;;;;;;;;;;;;;;;;3.414.394;3.403.468;;90369;10926;79443
152;3.504.763;23,7,217,88;192,168,43,47;TLSv1,2;328;New Session Ticket, Change Cipher Spec, Encrypted Handshake Message;;;;;;;;;;;;;;;;3.504.763;3.414.394;;2924;90369;87445
153;3.507.687;192,168,43,47;23,7,217,88;TLSv1,2;587;Application Data;;;;;;;;;;;;;;;;3.507.687;3.504.763;;151303;2924;148379
154;3.658.990;23,7,217,88;192,168,43,47;TCP;54;443  >  49727 [ACK] Seq=6053 Ack=877 Win=31360 Len=0;;;;;;;;;;;;;;;;3.658.990;3.507.687;;121757;151303;29546
155;3.780.747;23,7,217,88;192,168,43,47;TLSv1,2;728;Application Data;;;;;;;;;;;;;;;;3.780.747;3.658.990;;3272;121757;118485
156;3.784.019;192,168,43,47;23,7,217,88;TCP;54;49727  >  443 [FIN, ACK] Seq=877 Ack=6727 Win=64512 Len=0;;;;;;;;;;;;;;;;3.784.019;3.780.747;;79859;3272;76587
157;3.863.878;23,7,217,88;192,168,43,47;TCP;54;[TCP Previous segment not captured] 443  >  49727 [FIN, ACK] Seq=6758 Ack=878 Win=31360 Len=0;;;;;;;;;;;;;;;;3.863.878;3.784.019;;137;79859;79722
158;3.864.015;192,168,43,47;23,7,217,88;TCP;54;[TCP Dup ACK 156#1] 49727  >  443 [ACK] Seq=878 Ack=6727 Win=64512 Len=0;;;;;;;;;;;;;;;;3.864.015;3.863.878;;290;137;153
159;3.864.305;23,7,217,88;192,168,43,47;TCP;85;[TCP Out-Of-Order] 443  >  49727 [PSH, ACK] Seq=6727 Ack=878 Win=31360 Len=31;;;;;;;;;;;;;;;;3.864.305;3.864.015;;73;290;217
160;3.864.378;192,168,43,47;23,7,217,88;TCP;54;49727  >  443 [RST, ACK] Seq=878 Ack=6758 Win=0 Len=0;;;;;;;;;;;;;;;;3.864.378;3.864.305;;26622;73;26549
163;3.891.000;192,168,43,47;23,7,217,88;TCP;66;49728  >  443 [SYN] Seq=0 Win=64240 Len=0 MSS=1460 WS=256 SACK_PERM=1;;;;;;;;;;;;;;;;3.891.000;3.864.378;;82388;26622;55766
164;3.973.388;23,7,217,88;192,168,43,47;TCP;66;443  >  49728 [SYN, ACK] Seq=0 Ack=1 Win=29200 Len=0 MSS=1400 SACK_PERM=1 WS=128;;;;;;;;;;;;;;;;3.973.388;3.891.000;;237;82388;82151
165;3.973.625;192,168,43,47;23,7,217,88;TCP;54;49728  >  443 [ACK] Seq=1 Ack=1 Win=65792 Len=0;;;;;;;;;;;;;;;;3.973.625;3.973.388;;1712;237;1475
166;3.975.337;192,168,43,47;23,7,217,88;TLSv1,2;271;Client Hello;;;;;;;;;;;;;;;;3.975.337;3.973.625;;79235;1712;77523
167;4.054.572;23,7,217,88;192,168,43,47;TCP;54;443  >  49728 [ACK] Seq=1 Ack=218 Win=30336 Len=0;;;;;;;;;;;;;;;;4.054.572;3.975.337;;0;79235;79235
168;4.054.572;23,7,217,88;192,168,43,47;TLSv1,2;1454;Server Hello;;;;;;;;;;;;;;;;4.054.572;4.054.572;;0;0;0
169;4.054.572;23,7,217,88;192,168,43,47;TCP;1350;[TCP Previous segment not captured] 443  >  49728 [PSH, ACK] Seq=2801 Ack=218 Win=30336 Len=1296 [TCP segment of a reassembled PDU] [TCP segment of a reassembled PDU];;;;;;;;;;;;;;;;4.054.572;4.054.572;;0;0;0
170;4.054.572;23,7,217,88;192,168,43,47;TCP;1454;[TCP Out-Of-Order] 443  >  49728 [ACK] Seq=1401 Ack=218 Win=30336 Len=1400;;;;;;;;;;;;;;;;4.054.572;4.054.572;;0;0;0
171;4.054.572;23,7,217,88;192,168,43,47;TLSv1,2;1454;Certificate Status [TCP segment of a reassembled PDU];;;;;;;;;;;;;;;;4.054.572;4.054.572;;237;0;237
172;4.054.809;192,168,43,47;23,7,217,88;TCP;66;49728  >  443 [ACK] Seq=218 Ack=1401 Win=65792 Len=0 SLE=2801 SRE=4097;;;;;;;;;;;;;;;;4.054.809;4.054.572;;218;237;19
173;4.055.027;192,168,43,47;23,7,217,88;TCP;54;49728  >  443 [ACK] Seq=218 Ack=4097 Win=65792 Len=0;;;;;;;;;;;;;;;;4.055.027;4.054.809;;102;218;116
174;4.055.129;192,168,43,47;23,7,217,88;TCP;54;49728  >  443 [ACK] Seq=218 Ack=5497 Win=65792 Len=0;;;;;;;;;;;;;;;;4.055.129;4.055.027;;68025;102;67923
175;4.123.154;23,7,217,88;192,168,43,47;TLSv1,2;336;Server Key Exchange, Server Hello Done;;;;;;;;;;;;;;;;4.123.154;4.055.129;;7465;68025;60560
176;4.130.619;192,168,43,47;23,7,217,88;TLSv1,2;180;Client Key Exchange, Change Cipher Spec, Encrypted Handshake Message;;;;;;;;;;;;;;;;4.130.619;4.123.154;;72698;7465;65233
177;4.203.317;23,7,217,88;192,168,43,47;TLSv1,2;328;New Session Ticket, Change Cipher Spec, Encrypted Handshake Message;;;;;;;;;;;;;;;;4.203.317;4.130.619;;7512;72698;65186
178;4.210.829;192,168,43,47;23,7,217,88;TLSv1,2;587;Application Data;;;;;;;;;;;;;;;;4.210.829;4.203.317;;107201;7512;99689
179;4.318.030;23,7,217,88;192,168,43,47;TLSv1,2;723;Application Data;;;;;;;;;;;;;;;;4.318.030;4.210.829;;3253;107201;103948
180;4.321.283;192,168,43,47;23,7,217,88;TCP;54;49728  >  443 [FIN, ACK] Seq=877 Ack=6722 Win=64512 Len=0;;;;;;;;;;;;;;;;4.321.283;4.318.030;;67584;3253;64331
183;4.388.867;192,168,43,47;23,7,217,88;TCP;66;49730  >  443 [SYN] Seq=0 Win=64240 Len=0 MSS=1460 WS=256 SACK_PERM=1;;;;;;;;;;;;;;;;4.388.867;4.321.283;;14237;67584;53347
184;4.403.104;23,7,217,88;192,168,43,47;TLSv1,2;85;Encrypted Alert;;;;;;;;;;;;;;;;4.403.104;4.388.867;;179;14237;14058
185;4.403.283;192,168,43,47;23,7,217,88;TCP;54;49728  >  443 [RST, ACK] Seq=878 Ack=6753 Win=0 Len=0;;;;;;;;;;;;;;;;4.403.283;4.403.104;;336;179;157
186;4.403.619;23,7,217,88;192,168,43,47;TCP;54;443  >  49728 [FIN, ACK] Seq=6753 Ack=878 Win=31360 Len=0;;;;;;;;;;;;;;;;4.403.619;4.403.283;;61480;336;61144
187;4.465.099;23,7,217,88;192,168,43,47;TCP;66;443  >  49730 [SYN, ACK] Seq=0 Ack=1 Win=29200 Len=0 MSS=1400 SACK_PERM=1 WS=128;;;;;;;;;;;;;;;;4.465.099;4.403.619;;218;61480;61262
188;4.465.317;192,168,43,47;23,7,217,88;TCP;54;49730  >  443 [ACK] Seq=1 Ack=1 Win=65792 Len=0;;;;;;;;;;;;;;;;4.465.317;4.465.099;;1041;218;823
189;4.466.358;192,168,43,47;23,7,217,88;TLSv1,2;271;Client Hello;;;;;;;;;;;;;;;;4.466.358;4.465.317;;87462;1041;86421
190;4.553.820;23,7,217,88;192,168,43,47;TCP;54;443  >  49730 [ACK] Seq=1 Ack=218 Win=30336 Len=0;;;;;;;;;;;;;;;;4.553.820;4.466.358;;301;87462;87161
191;4.554.121;23,7,217,88;192,168,43,47;TLSv1,2;1454;Server Hello;;;;;;;;;;;;;;;;4.554.121;4.553.820;;2617;301;2316
192;4.556.738;23,7,217,88;192,168,43,47;TCP;1454;443  >  49730 [ACK] Seq=1401 Ack=218 Win=30336 Len=1400 [TCP segment of a reassembled PDU];;;;;;;;;;;;;;;;4.556.738;4.554.121;;76;2617;2541
193;4.556.814;192,168,43,47;23,7,217,88;TCP;54;49730  >  443 [ACK] Seq=218 Ack=2801 Win=65792 Len=0;;;;;;;;;;;;;;;;4.556.814;4.556.738;;489;76;413
194;4.557.303;23,7,217,88;192,168,43,47;TLSv1,2;1350;Certificate [TCP segment of a reassembled PDU];;;;;;;;;;;;;;;;4.557.303;4.556.814;;0;489;489
195;4.557.303;23,7,217,88;192,168,43,47;TLSv1,2;1454;Certificate Status [TCP segment of a reassembled PDU];;;;;;;;;;;;;;;;4.557.303;4.557.303;;88;0;88
196;4.557.391;192,168,43,47;23,7,217,88;TCP;54;49730  >  443 [ACK] Seq=218 Ack=5497 Win=65792 Len=0;;;;;;;;;;;;;;;;4.557.391;4.557.303;;66483;88;66395
197;4.623.874;23,7,217,88;192,168,43,47;TLSv1,2;336;Server Key Exchange, Server Hello Done;;;;;;;;;;;;;;;;4.623.874;4.557.391;;6931;66483;59552
198;4.630.805;192,168,43,47;23,7,217,88;TLSv1,2;180;Client Key Exchange, Change Cipher Spec, Encrypted Handshake Message;;;;;;;;;;;;;;;;4.630.805;4.623.874;;82054;6931;75123
199;4.712.859;23,7,217,88;192,168,43,47;TLSv1,2;328;New Session Ticket, Change Cipher Spec, Encrypted Handshake Message;;;;;;;;;;;;;;;;4.712.859;4.630.805;;2382;82054;79672
200;4.715.241;192,168,43,47;23,7,217,88;TLSv1,2;587;Application Data;;;;;;;;;;;;;;;;4.715.241;4.712.859;;119006;2382;116624
202;4.834.247;23,7,217,88;192,168,43,47;TCP;54;443  >  49730 [ACK] Seq=6053 Ack=877 Win=31360 Len=0;;;;;;;;;;;;;;;;4.834.247;4.715.241;;124262;119006;5256
203;4.958.509;23,7,217,88;192,168,43,47;TLSv1,2;319;Application Data;;;;;;;;;;;;;;;;4.958.509;4.834.247;;2542;124262;121720
204;4.961.051;192,168,43,47;23,7,217,88;TCP;54;49730  >  443 [FIN, ACK] Seq=877 Ack=6318 Win=64768 Len=0;;;;;;;;;;;;;;;;4.961.051;4.958.509;;39856;2542;37314
207;5.000.907;192,168,43,47;23,7,217,88;TCP;66;49731  >  443 [SYN] Seq=0 Win=64240 Len=0 MSS=1460 WS=256 SACK_PERM=1;;;;;;;;;;;;;;;;5.000.907;4.961.051;;46224;39856;6368
208;5.047.131;23,7,217,88;192,168,43,47;TLSv1,2;85;Encrypted Alert;;;;;;;;;;;;;;;;5.047.131;5.000.907;;165;46224;46059
209;5.047.296;192,168,43,47;23,7,217,88;TCP;54;49730  >  443 [RST, ACK] Seq=878 Ack=6349 Win=0 Len=0;;;;;;;;;;;;;;;;5.047.296;5.047.131;;305;165;140
210;5.047.601;23,7,217,88;192,168,43,47;TCP;54;443  >  49730 [FIN, ACK] Seq=6349 Ack=878 Win=31360 Len=0;;;;;;;;;;;;;;;;5.047.601;5.047.296;;43563;305;43258
211;5.091.164;23,7,217,88;192,168,43,47;TCP;66;443  >  49731 [SYN, ACK] Seq=0 Ack=1 Win=29200 Len=0 MSS=1400 SACK_PERM=1 WS=128;;;;;;;;;;;;;;;;5.091.164;5.047.601;;225;43563;43338
212;5.091.389;192,168,43,47;23,7,217,88;TCP;54;49731  >  443 [ACK] Seq=1 Ack=1 Win=65792 Len=0;;;;;;;;;;;;;;;;5.091.389;5.091.164;;1017;225;792
213;5.092.406;192,168,43,47;23,7,217,88;TLSv1,2;271;Client Hello;;;;;;;;;;;;;;;;5.092.406;5.091.389;;70775;1017;69758
214;5.163.181;23,7,217,88;192,168,43,47;TCP;54;443  >  49731 [ACK] Seq=1 Ack=218 Win=30336 Len=0;;;;;;;;;;;;;;;;5.163.181;5.092.406;;742;70775;70033
215;5.163.923;23,7,217,88;192,168,43,47;TCP;1454;[TCP Previous segment not captured] 443  >  49731 [ACK] Seq=1401 Ack=218 Win=30336 Len=1400 [TCP segment of a reassembled PDU];;;;;;;;;;;;;;;;5.163.923;5.163.181;;89;742;653
216;5.164.012;192,168,43,47;23,7,217,88;TCP;66;[TCP Dup ACK 212#1] 49731  >  443 [ACK] Seq=218 Ack=1 Win=65792 Len=0 SLE=1401 SRE=2801;;;;;;;;;;;;;;;;5.164.012;5.163.923;;322;89;233
217;5.164.334;23,7,217,88;192,168,43,47;TCP;1350;443  >  49731 [PSH, ACK] Seq=2801 Ack=218 Win=30336 Len=1296 [TCP segment of a reassembled PDU] [TCP segment of a reassembled PDU];;;;;;;;;;;;;;;;5.164.334;5.164.012;;53;322;269
218;5.164.387;192,168,43,47;23,7,217,88;TCP;66;[TCP Dup ACK 212#2] 49731  >  443 [ACK] Seq=218 Ack=1 Win=65792 Len=0 SLE=1401 SRE=4097;;;;;;;;;;;;;;;;5.164.387;5.164.334;;1023;53;970
219;5.165.410;23,7,217,88;192,168,43,47;TLSv1,2;1454;[TCP Fast Retransmission] , Server Hello;;;;;;;;;;;;;;;;5.165.410;5.164.387;;0;1023;1023
220;5.165.410;23,7,217,88;192,168,43,47;TLSv1,2;1454;Ignored Unknown Record;;;;;;;;;;;;;;;;5.165.410;5.165.410;;121;0;121
221;5.165.531;192,168,43,47;23,7,217,88;TCP;54;49731  >  443 [ACK] Seq=218 Ack=4097 Win=65792 Len=0;;;;;;;;;;;;;;;;5.165.531;5.165.410;;39385;121;39264
222;5.204.916;192,168,43,47;23,7,217,88;TCP;54;49731  >  443 [ACK] Seq=218 Ack=5497 Win=65792 Len=0;;;;;;;;;;;;;;;;5.204.916;5.165.531;;38505;39385;880
223;5.243.421;23,7,217,88;192,168,43,47;TLSv1,2;336;Ignored Unknown Record;;;;;;;;;;;;;;;;5.243.421;5.204.916;;6915;38505;31590
224;5.250.336;192,168,43,47;23,7,217,88;TLSv1,2;180;Client Key Exchange, Change Cipher Spec, Encrypted Handshake Message;;;;;;;;;;;;;;;;5.250.336;5.243.421;;82090;6915;75175
225;5.332.426;23,7,217,88;192,168,43,47;TLSv1,2;328;New Session Ticket, Change Cipher Spec, Encrypted Handshake Message;;;;;;;;;;;;;;;;5.332.426;5.250.336;;2562;82090;79528
226;5.334.988;192,168,43,47;23,7,217,88;TLSv1,2;587;Application Data;;;;;;;;;;;;;;;;5.334.988;5.332.426;;6078;2562;3516
227;5.341.066;147,135,46,101;192,168,43,47;TCP;54;80  >  49717 [FIN, ACK] Seq=151 Ack=1 Win=26800 Len=0;;;;;;;;;;;;;;;;5.341.066;5.334.988;;161;6078;5917
228;5.341.227;192,168,43,47;147,135,46,101;TCP;54;49717  >  80 [ACK] Seq=1 Ack=152 Win=65535 Len=0;;;;;;;;;;;;;;;;5.341.227;5.341.066;;83026;161;82865
229;5.424.253;23,7,217,88;192,168,43,47;TLSv1,2;746;Application Data;;;;;;;;;;;;;;;;5.424.253;5.341.227;;2960;83026;80066
230;5.427.213;192,168,43,47;23,7,217,88;TCP;54;49731  >  443 [FIN, ACK] Seq=877 Ack=6745 Win=64512 Len=0;;;;;;;;;;;;;;;;5.427.213;5.424.253;;73355;2960;70395
233;5.500.568;192,168,43,47;23,7,217,88;TCP;66;49733  >  443 [SYN] Seq=0 Win=64240 Len=0 MSS=1460 WS=256 SACK_PERM=1;;;;;;;;;;;;;;;;5.500.568;5.427.213;;11422;73355;61933
234;5.511.990;23,7,217,88;192,168,43,47;TCP;54;[TCP Previous segment not captured] 443  >  49731 [FIN, ACK] Seq=6776 Ack=878 Win=31360 Len=0;;;;;;;;;;;;;;;;5.511.990;5.500.568;;151;11422;11271
235;5.512.141;192,168,43,47;23,7,217,88;TCP;54;[TCP Dup ACK 230#1] 49731  >  443 [ACK] Seq=878 Ack=6745 Win=64512 Len=0;;;;;;;;;;;;;;;;5.512.141;5.511.990;;330;151;179
236;5.512.471;23,7,217,88;192,168,43,47;TCP;85;[TCP Out-Of-Order] 443  >  49731 [PSH, ACK] Seq=6745 Ack=878 Win=31360 Len=31;;;;;;;;;;;;;;;;5.512.471;5.512.141;;86;330;244
237;5.512.557;192,168,43,47;23,7,217,88;TCP;54;49731  >  443 [RST, ACK] Seq=878 Ack=6776 Win=0 Len=0;;;;;;;;;;;;;;;;5.512.557;5.512.471;;70477;86;70391
239;5.583.034;23,7,217,88;192,168,43,47;TCP;66;443  >  49733 [SYN, ACK] Seq=0 Ack=1 Win=29200 Len=0 MSS=1400 SACK_PERM=1 WS=128;;;;;;;;;;;;;;;;5.583.034;5.512.557;;224;70477;70253
240;5.583.258;192,168,43,47;23,7,217,88;TCP;54;49733  >  443 [ACK] Seq=1 Ack=1 Win=65792 Len=0;;;;;;;;;;;;;;;;5.583.258;5.583.034;;1133;224;909
241;5.584.391;192,168,43,47;23,7,217,88;TLSv1,2;271;Client Hello;;;;;;;;;;;;;;;;5.584.391;5.583.258;;77838;1133;76705
242;5.662.229;23,7,217,88;192,168,43,47;TCP;54;443  >  49733 [ACK] Seq=1 Ack=218 Win=30336 Len=0;;;;;;;;;;;;;;;;5.662.229;5.584.391;;737;77838;77101
243;5.662.966;23,7,217,88;192,168,43,47;TLSv1,2;1350;[TCP Previous segment not captured] , Ignored Unknown Record;;;;;;;;;;;;;;;;5.662.966;5.662.229;;88;737;649
244;5.663.054;192,168,43,47;23,7,217,88;TCP;66;[TCP Dup ACK 240#1] 49733  >  443 [ACK] Seq=218 Ack=1 Win=65792 Len=0 SLE=2801 SRE=4097;;;;;;;;;;;;;;;;5.663.054;5.662.966;;511;88;423
245;5.663.565;23,7,217,88;192,168,43,47;TCP;1454;[TCP Out-Of-Order] 443  >  49733 [ACK] Seq=1401 Ack=218 Win=30336 Len=1400;;;;;;;;;;;;;;;;5.663.565;5.663.054;;0;511;511
246;5.663.565;23,7,217,88;192,168,43,47;TCP;1454;[TCP Out-Of-Order] 443  >  49733 [ACK] Seq=1 Ack=218 Win=30336 Len=1400;;;;;;;;;;;;;;;;5.663.565;5.663.565;;67;0;67
247;5.663.632;192,168,43,47;23,7,217,88;TCP;66;[TCP Dup ACK 240#2] 49733  >  443 [ACK] Seq=218 Ack=1 Win=65792 Len=0 SLE=1401 SRE=4097;;;;;;;;;;;;;;;;5.663.632;5.663.565;;141;67;74
248;5.663.773;192,168,43,47;23,7,217,88;TCP;54;49733  >  443 [ACK] Seq=218 Ack=4097 Win=65792 Len=0;;;;;;;;;;;;;;;;5.663.773;5.663.632;;549;141;408
249;5.664.322;23,7,217,88;192,168,43,47;TLSv1,2;1454;Ignored Unknown Record;;;;;;;;;;;;;;;;5.664.322;5.663.773;;40634;549;40085
250;5.704.956;192,168,43,47;23,7,217,88;TCP;54;49733  >  443 [ACK] Seq=218 Ack=5497 Win=65792 Len=0;;;;;;;;;;;;;;;;5.704.956;5.664.322;;38422;40634;2212
251;5.743.378;23,7,217,88;192,168,43,47;TLSv1,2;336;Ignored Unknown Record;;;;;;;;;;;;;;;;5.743.378;5.704.956;;7542;38422;30880
252;5.750.920;192,168,43,47;23,7,217,88;TLSv1,2;180;Client Key Exchange, Change Cipher Spec, Encrypted Handshake Message;;;;;;;;;;;;;;;;5.750.920;5.743.378;;72034;7542;64492
253;5.822.954;23,7,217,88;192,168,43,47;TLSv1,2;328;New Session Ticket, Change Cipher Spec, Encrypted Handshake Message;;;;;;;;;;;;;;;;5.822.954;5.750.920;;2482;72034;69552
254;5.825.436;192,168,43,47;23,7,217,88;TLSv1,2;587;Application Data;;;;;;;;;;;;;;;;5.825.436;5.822.954;;96543;2482;94061
255;5.921.979;23,7,217,88;192,168,43,47;TLSv1,2;744;Application Data;;;;;;;;;;;;;;;;5.921.979;5.825.436;;3696;96543;92847
256;5.925.675;192,168,43,47;23,7,217,88;TCP;54;49733  >  443 [FIN, ACK] Seq=877 Ack=6743 Win=64512 Len=0;;;;;;;;;;;;;;;;5.925.675;5.921.979;;85930;3696;82234
259;6.011.605;23,7,217,88;192,168,43,47;TLSv1,2;85;Encrypted Alert;;;;;;;;;;;;;;;;6.011.605;5.925.675;;170;85930;85760
260;6.011.775;192,168,43,47;23,7,217,88;TCP;54;49733  >  443 [RST, ACK] Seq=878 Ack=6774 Win=0 Len=0;;;;;;;;;;;;;;;;6.011.775;6.011.605;;317;170;147
261;6.012.092;23,7,217,88;192,168,43,47;TCP;54;443  >  49733 [FIN, ACK] Seq=6774 Ack=878 Win=31360 Len=0;;;;;;;;;;;;;;;;6.012.092;6.011.775;;364;317;47
262;6.012.456;192,168,43,47;23,7,217,88;TCP;66;49734  >  443 [SYN] Seq=0 Win=64240 Len=0 MSS=1460 WS=256 SACK_PERM=1;;;;;;;;;;;;;;;;6.012.456;6.012.092;;85010;364;84646
263;6.097.466;23,7,217,88;192,168,43,47;TCP;66;443  >  49734 [SYN, ACK] Seq=0 Ack=1 Win=29200 Len=0 MSS=1400 SACK_PERM=1 WS=128;;;;;;;;;;;;;;;;6.097.466;6.012.456;;223;85010;84787
264;6.097.689;192,168,43,47;23,7,217,88;TCP;54;49734  >  443 [ACK] Seq=1 Ack=1 Win=65792 Len=0;;;;;;;;;;;;;;;;6.097.689;6.097.466;;1001;223;778
265;6.098.690;192,168,43,47;23,7,217,88;TLSv1,2;271;Client Hello;;;;;;;;;;;;;;;;6.098.690;6.097.689;;77511;1001;76510
266;6.176.201;23,7,217,88;192,168,43,47;TCP;54;443  >  49734 [ACK] Seq=1 Ack=218 Win=30336 Len=0;;;;;;;;;;;;;;;;6.176.201;6.098.690;;692;77511;76819
267;6.176.893;23,7,217,88;192,168,43,47;TLSv1,2;1350;[TCP Previous segment not captured] , Ignored Unknown Record;;;;;;;;;;;;;;;;6.176.893;6.176.201;;0;692;692
268;6.176.893;23,7,217,88;192,168,43,47;TCP;1454;[TCP Out-Of-Order] 443  >  49734 [ACK] Seq=1401 Ack=218 Win=30336 Len=1400;;;;;;;;;;;;;;;;6.176.893;6.176.893;;0;0;0
269;6.176.893;23,7,217,88;192,168,43,47;TCP;1454;[TCP Out-Of-Order] 443  >  49734 [ACK] Seq=1 Ack=218 Win=30336 Len=1400;;;;;;;;;;;;;;;;6.176.893;6.176.893;;109;0;109
270;6.177.002;192,168,43,47;23,7,217,88;TCP;66;[TCP Dup ACK 264#1] 49734  >  443 [ACK] Seq=218 Ack=1 Win=65792 Len=0 SLE=2801 SRE=4097;;;;;;;;;;;;;;;;6.177.002;6.176.893;;176;109;67
271;6.177.178;192,168,43,47;23,7,217,88;TCP;66;[TCP Dup ACK 264#2] 49734  >  443 [ACK] Seq=218 Ack=1 Win=65792 Len=0 SLE=1401 SRE=4097;;;;;;;;;;;;;;;;6.177.178;6.177.002;;128;176;48
272;6.177.306;192,168,43,47;23,7,217,88;TCP;54;49734  >  443 [ACK] Seq=218 Ack=4097 Win=65792 Len=0;;;;;;;;;;;;;;;;6.177.306;6.177.178;;186;128;58
273;6.177.492;23,7,217,88;192,168,43,47;TLSv1,2;1454;Ignored Unknown Record;;;;;;;;;;;;;;;;6.177.492;6.177.306;;40387;186;40201
274;6.217.879;192,168,43,47;23,7,217,88;TCP;54;49734  >  443 [ACK] Seq=218 Ack=5497 Win=65792 Len=0;;;;;;;;;;;;;;;;6.217.879;6.177.492;;29282;40387;11105
275;6.247.161;23,7,217,88;192,168,43,47;TLSv1,2;336;Ignored Unknown Record;;;;;;;;;;;;;;;;6.247.161;6.217.879;;6787;29282;22495
276;6.253.948;192,168,43,47;23,7,217,88;TLSv1,2;180;Client Key Exchange, Change Cipher Spec, Encrypted Handshake Message;;;;;;;;;;;;;;;;6.253.948;6.247.161;;74320;6787;67533
278;6.328.268;23,7,217,88;192,168,43,47;TLSv1,2;328;New Session Ticket, Change Cipher Spec, Encrypted Handshake Message;;;;;;;;;;;;;;;;6.328.268;6.253.948;;2509;74320;71811
279;6.330.777;192,168,43,47;23,7,217,88;TLSv1,2;587;Application Data;;;;;;;;;;;;;;;;6.330.777;6.328.268;;105318;2509;102809
280;6.436.095;23,7,217,88;192,168,43,47;TLSv1,2;741;Application Data;;;;;;;;;;;;;;;;6.436.095;6.330.777;;2748;105318;102570
281;6.438.843;192,168,43,47;23,7,217,88;TCP;54;49734  >  443 [FIN, ACK] Seq=877 Ack=6740 Win=64512 Len=0;;;;;;;;;;;;;;;;6.438.843;6.436.095;;40151;2748;37403
